{
  "schemaVersion": "1.0",
  "collectorType": "unity",
  "collectorVersion": "0.1.0",
  "projectId": "11111111-1111-1111-1111-111111111111",
  "commitSha": "bbbbbbbbbbbbbbbb",
  "branch": "feature/character-assets",
  "startedAt": "2026-07-16T10:00:00Z",
  "finishedAt": "2026-07-16T10:01:30Z",
  "status": "succeeded",
  "metrics": [
    {
      "name": "average_fps",
      "value": 54,
      "unit": "fps",
      "baselineValue": 60
    },
    {
      "name": "memory_mb",
      "value": 1250,
      "unit": "MB",
      "baselineValue": 1000
    }
  ],
  "issues": [
    {
      "category": "asset",
      "severity": "Warning",
      "title": "4K texture detected",
      "description": "Hero texture is 4096x4096.",
      "source": "Assets/Characters/Hero.png"
    }
  ]
}